index,question,options,option1,option2,option3,option4,answer,explanation
1,Virtual memory uses disk space as an extension of _________,"['a) secondary storage', 'b) main memory', 'c) tertiary storage', 'd) none of the mentioned']",a) secondary storage,b) main memory,c) tertiary storage,d) none of the mentioned,b,None.
2,Using swap space significantly _________ system performance,"['a) increases', 'b) decreases', 'c) maintains', 'd) does not affect']",a) increases,b) decreases,c) maintains,d) does not affect,b,Disk access is much slower than memory access.
3,Linux __________ the use of multiple swap spaces,"['a) allows', 'b) does not allow', 'c) may allow', 'd) none of the mentioned']",a) allows,b) does not allow,c) may allow,d) none of the mentioned,a,Putting these swap spaces on separate disks reduces the load places on the I/O system.
4,A single swap space ______ reside in two places,"['a) can', 'b) cannot', 'c) must not', 'd) none of the mentioned']",a) can,b) cannot,c) must not,d) none of the mentioned,a,None.
5,"If the swap space is simply a large file, within the file system, ____________ used to create it, name it and allocate its space","['a) special routines must be', 'b) normal file system routines can be', 'c) normal file system routines cannot be', 'd) swap space storage manager is']",a) special routines must be,b) normal file system routines can be,c) normal file system routines cannot be,d) swap space storage manager is,b,None.
6,"For swap space created in a separate disk partition where no file system or directory structure is placed, _____________ used to allocate and deallocate the blocks","['a) special routines must be', 'b) normal file system routines can be', 'c) normal file system routines cannot be', 'd) swap space storage manager is']",a) special routines must be,b) normal file system routines can be,c) normal file system routines cannot be,d) swap space storage manager is,d,None.
7,"When a fixed amount of swap space is created during disk partitioning, more swap space can be added only by?","['I) repartitioning of the disk', 'II) adding another swap space elsewhere', 'a) only I', 'b) only II']",I) repartitioning of the disk,II) adding another swap space elsewhere,a) only I,b) only II,c,None.
8,"In UNIX, two per process ________ are used by the kernel to track swap space use","['a) process tables', 'b) swap maps', 'c) memory maps', 'd) partition maps']",a) process tables,b) swap maps,c) memory maps,d) partition maps,b,None.
9,It is __________ to reread a page from the file system than to write it to swap space and then to reread it from there,"['a) useless', 'b) less efficient', 'c) more efficient', 'd) none of the mentioned']",a) useless,b) less efficient,c) more efficient,d) none of the mentioned,c,None.
